kernel_benchmark/main_res.csv
M,K,N,SplitK,Sparsity,Kernel,Duration(ns),TFLOPS
8192,29568,8,7,40,SpInfer,360332.3,10.75545
8192,29568,8,7,40,cuBLAS_TC,534830.9,7.24628
8192,29568,8,7,40,Flash-LLM,625063.9,6.20022
8192,29568,8,7,50,SpInfer,317595.6,12.20274
8192,29568,8,7,50,cuBLAS_TC,534722.5,7.24775
8192,29568,8,7,50,Flash-LLM,521786.4,7.42744
8192,29568,8,7,40,SpInfer,360597.5,10.74754
8192,29568,8,7,40,cuBLAS_TC,534764.5,7.24718
8192,29568,8,7,40,Flash-LLM,625118.2,6.19969
